<?xml version="1.0" encoding="UTF-8"?>
<directive xmlns="http://www.github.com/landyking/link"
           xmlns:xsi="http://www.w3.org/2001/XMLSchema-instance"
           xsi:schemaLocation="http://www.github.com/landyking/link http://www.github.com/landyking/link/link-1.0.xsd">
    <description>QueryTranslatorTest</description>
    <input>
        <param name="name"/>
        <param name="age"/>
        <param name="address"/>
        <param name="hello">
            <processors>
                <TextToList/>
            </processors>
        </param>
    </input>
    <execution>
        <custom id="default" className="com.github.landyking.link.execution.custom.InputGotoOutput"/>
    </execution>
    <executionEnding/>
    <output>
        <list name="root">
            <param name="name" />
            <param name="age" />
            <param name="address" from="[exec][default].data.![#this[address]]"/>
            <param name="hello" />
            <param name="hello2" from="[exec][default].data.![#this[hello]]"/>
        </list>
    </output>
    <resultRender/>
    <dependencys></dependencys>
</directive>