<?xml version="1.0" encoding="UTF-8"?>
<directive xmlns="http://www.github.com/landyking/link"
           xmlns:xsi="http://www.w3.org/2001/XMLSchema-instance"
           xsi:schemaLocation="http://www.github.com/landyking/link http://www.github.com/landyking/link/link-1.0.xsd">
    <description>dict check test</description>
    <input>
        <param name="like">
        </param>
        <param name="like2"/>
        <param name="likeEmpty" notEmpty="false">
        </param>
        <param name="likeLeft">
        </param>
        <param name="likeRight">
        </param>
        <param name="likeBoth">
        </param>
    </input>
    <execution>
        <custom id="default" className="com.github.landyking.link.execution.custom.InputGotoOutput"/>
    </execution>
    <executionEnding/>
    <output>
        <map name="root">
            <param name="like" />
            <param name="likeEmpty" />
            <param name="likeBoth" />
            <param name="likeBoth2" from="#contact('%',#root[input][like2],'%')"/>
            <param name="likeRight" />
            <param name="likeRight2" from="#contact(#root[input][like2],'%')"/>
            <param name="likeLeft" />
            <param name="likeLeft2" from="#contact('%',#root[input][like2])"/>
        </map>
    </output>
    <resultRender/>
    <dependencys></dependencys>
</directive>