<?xml version="1.0" encoding="UTF-8"?>
<directive xmlns="http://www.github.com/landyking/link"
           xmlns:xsi="http://www.w3.org/2001/XMLSchema-instance"
           xsi:schemaLocation="http://www.github.com/landyking/link http://www.github.com/landyking/link/link-1.0.xsd">
    <description></description>
    <input>
        <param name="33"/>
        <param name="3"/>
        <param name="test"/>
    </input>
    <execution transaction="false">
        <dbDelete>
            <table>
                t_test
            </table>
            <where>
                hello = :test and address in (:lala)
            </where>
        </dbDelete>
    </execution>
    <output>
        <param name="1" from=""/>
        <param name="12" from=""/>
        <param name="123" from=""/>
    </output>
    <dependencys>
    </dependencys>
</directive>
