<?xml version="1.0" encoding="UTF-8"?>
<directive xmlns="http://www.github.com/landyking/link"
           xmlns:xsi="http://www.w3.org/2001/XMLSchema-instance"
           xsi:schemaLocation="http://www.github.com/landyking/link http://www.github.com/landyking/link/link-1.0.xsd">
    <description>执行SQL语句</description>
    <input>
        <param name="dsName" desc="数据源名称"/>
        <param name="sql" desc="SQL语句"/>
        <param name="page" desc="页码"/>
        <param name="limit" desc="页长"/>
    </input>
    <execution>
        <custom className=""/>
    </execution>
    <output custom="true">
    </output>
    <dependencys></dependencys>
</directive>