<?xml version="1.0" encoding="UTF-8"?>
<directive xmlns="http://www.github.com/landyking/link"
           xmlns:xsi="http://www.w3.org/2001/XMLSchema-instance"
           xsi:schemaLocation="http://www.github.com/landyking/link http://www.github.com/landyking/link/link-1.0.xsd">
    <description>列出数据源</description>
    <input>
        <param name="page" default="1"/>
        <param name="limit" default="10"/>
    </input>
    <execution>
        <custom className=""/>
    </execution>
    <output>
        <param name="name" desc="名称"/>
        <param name="description" desc="描述"/>
        <param name="driverClass" desc="驱动类"/>
        <param name="jdbcUrl" desc="连接地址"/>
        <param name="account" desc="账号"/>
        <param name="password" desc="密码"/>
        <param name="extraConfig" desc="其他参数"/>
    </output>
    <dependencys></dependencys>
</directive>