<?xml version="1.0" encoding="UTF-8"?>
<directive xmlns="http://www.github.com/landyking/link"
           xmlns:xsi="http://www.w3.org/2001/XMLSchema-instance"
           xsi:schemaLocation="http://www.github.com/landyking/link http://www.github.com/landyking/link/link-1.0.xsd">
    <description>列出数据库表</description>
    <input>
        <param name="dsName" desc="数据源名称"/>
        <param name="catalog" desc="类别"/>
        <param name="schema" desc="格式"/>
    </input>
    <execution>
        <custom className=""/>
    </execution>
    <output>
        <param name="tableName"/>
        <param name="tableComment"/>
    </output>
    <dependencys></dependencys>
</directive>