<?xml version="1.0" encoding="UTF-8"?>
<directive xmlns="http://www.github.com/landyking/link"
           xmlns:xsi="http://www.w3.org/2001/XMLSchema-instance"
           xsi:schemaLocation="http://www.github.com/landyking/link http://www.github.com/landyking/link/link-1.0.xsd">
    <input>
        <param name="" desc="" notEmpty="false" default="" fixed="">
            <processors>
            </processors>
        </param>
    </input>

    <execution>
        <dbInsert>
            <field ignoreNull="false" from="" column=""></field>
            <model></model>
        </dbInsert>
    </execution>
    <dependencys>
        <dependency></dependency>
    </dependencys>
    <output>
        <param name="count" from="num"/>
    </output>
</directive>
